{
  "id": "org_52north_001",
  "slug": "52north-spatial-information-research-gmbh",
  "name": "52Â°North Spatial Information Research GmbH",
  "created_at": "2024-01-15T10:30:00Z",
  "last_updated": "2024-11-22T08:15:30Z",
  "url": "https://52north.org/",
  "description": "Innovative ideas & technologies in geoinformatics",
  "category": "Science and medicine",
  "image_url": "https://summerofcode.withgoogle.com/media/org/52north-spatial-information-research-gmbh/gzamo2sqfwcmcobt-360.png",
  "image_slug": "52north-spatial-information-research-gmbh",
  "image_background_color": "#ffffff",
  "topics": [
    "geoinformatics",
    "sensor web",
    "web-based geoprocessing",
    "spatial data",
    "earth observation"
  ],
  "technologies": [
    "javascript",
    "java",
    "web services",
    "ogc standards",
    "python",
    "react"
  ],
  "total_projects": 25,
  "active_years": [2016, 2017, 2018, 2019, 2020, 2021, 2022, 2023, 2024, 2025],
  "first_year": 2016,
  "last_year": 2025,
  "is_currently_active": true,
  "contact": {
    "email": "gsoc@52north.org",
    "mailing_list": "gsoc-52n@52north.org",
    "irc_channel": "https://52n-gsoc.slack.com/ssb/redirect",
    "ideas_url": "https://52north.org/outreach-dissemination/google-summer-of-code/project-ideas/",
    "guide_url": "https://52north.org/software/contribute/"
  },
  "social": {
    "twitter": "https://twitter.com/fivetwon",
    "blog": "https://blog.52north.org/",
    "github": "https://github.com/52north",
    "gitlab": null,
    "facebook": null,
    "linkedin": null,
    "youtube": null,
    "instagram": null,
    "medium": null,
    "slack": "https://52n-gsoc.slack.com/ssb/redirect",
    "discord": null,
    "reddit": null,
    "mastodon": null,
    "twitch": null,
    "stackoverflow": null
  },
  "mentors": [
    {
      "name": "Benjamin Pross",
      "email": "b.pross@52north.org",
      "github": "bpross-52n",
      "profile_url": "https://52north.org/team/",
      "role": "Lead Mentor",
      "years": [2022, 2023, 2024, 2025]
    }
  ],
  "stats": {
    "projects_by_year": {
      "2025": 2,
      "2024": 2,
      "2023": 3,
      "2022": 5,
      "2021": 3,
      "2020": 3,
      "2019": 2,
      "2018": 1,
      "2017": 1,
      "2016": 3
    },
    "students_by_year": {
      "2025": 2,
      "2024": 2,
      "2023": 3,
      "2022": 5,
      "2021": 3,
      "2020": 3,
      "2019": 2,
      "2018": 1,
      "2017": 1,
      "2016": 3
    },
    "total_students": 25,
    "avg_projects_per_appeared_year": 2.5
  },
  "years": {
    "2025": {
      "projects_url": "https://summerofcode.withgoogle.com/programs/2025/organizations/52north-spatial-information-research-gmbh",
      "num_projects": 2,
      "projects": [
        {
          "id": "proj_52n_2025_001",
          "slug": "kommonitor-angular-migration",
          "title": "Complete Angular migration of the KomMonitor Web Client",
          "short_description": "The KomMonitor web client, a tool for geospatial data monitoring in urban planning, is currently based on AngularJS and requires a complete migration...",
          "description": "<p>The KomMonitor web client, a tool for geospatial data monitoring in urban planning, is currently based on AngularJS and requires a complete migration to the modern Angular framework to improve maintainability, scalability, and ease future contributions...</p>",
          "student_name": "goyalpranjal_",
          "student_profile": null,
          "code_url": null,
          "project_url": "https://summerofcode.withgoogle.com/programs/2025/projects/oiPd6sfN",
          "proposal_id": "M4rSb0sW",
          "difficulty": "medium",
          "status": "in-progress",
          "tags": ["angular", "web", "migration", "typescript", "frontend"],
          "mentor_names": ["Benjamin Pross"]
        },
        {
          "id": "proj_52n_2025_002",
          "slug": "weather-routing-tool",
          "title": "Weather Routing Tool",
          "short_description": "The Weather Routing Tool is a system designed to find optimal shipping routes between two geographic points, taking into account weather data...",
          "description": "<p>The Weather Routing Tool is a system designed to find optimal shipping routes between two geographic points, taking into account weather data, local boundaries, and other environmental factors...</p>",
          "student_name": "shreyass-ranganatha",
          "student_profile": null,
          "code_url": null,
          "project_url": "https://summerofcode.withgoogle.com/programs/2025/projects/JRNm78Uz",
          "proposal_id": "qoOOkYRa",
          "difficulty": "hard",
          "status": "in-progress",
          "tags": ["python", "algorithms", "optimization", "geospatial"],
          "mentor_names": []
        }
      ]
    },
    "2024": {
      "projects_url": "https://summerofcode.withgoogle.com/archive/2024/organizations/52north-spatial-information-research-gmbh/",
      "num_projects": 2,
      "projects": [
        {
          "id": "proj_52n_2024_001",
          "slug": "envirocar-mapbox-maplibre-migration",
          "title": "enviroCar App: Mapbox to MapLibre migration",
          "short_description": "The enviroCar Android app provides capabilities for visualizing user related tracks within a map...",
          "description": "<p>The enviroCar Android app provides capabilities for visualizing user related tracks within a map. For this feature, the app makes use of several libraries of the Mapbox mapping framework...</p>",
          "student_name": "Hitesh Kumar Saini",
          "student_profile": null,
          "code_url": "https://blog.52north.org/2024/08/26/envirocar-mapbox-to-maplibre-migration-gsoc-final-blog-post",
          "project_url": "https://summerofcode.withgoogle.com/archive/2024/projects/krHvyhrX/",
          "proposal_id": null,
          "difficulty": "medium",
          "status": "completed",
          "tags": ["android", "maps", "migration", "maplibre"],
          "mentor_names": []
        }
      ]
    }
  }
}

